experiment	agent_iteration	commit	time_us	status	description
1	15	HEAD	32.00	keep	Baseline 'previous_best' — initial benchmark
2	16	HEAD	54.25	discard	Advisor proposed a Triton kernel with 128-bit vectorized (8×fp16) loads/stores, 1D flat grid, BLOCK_
3	17	HEAD	54.81	discard	Advisor proposed: (1) explicit JIT warmup at module load time via dummy tensor call + torch.cuda.syn
4	18	HEAD	73.30	discard	Advisor proposed CUDA Graphs: lazily capture torch.add per unique tensor size, replay on hot path wi
5	19	HEAD	39.99	discard	Advisor proposed inline CUDA kernel with half2 vectorized loads (__ldg), strided grid pattern, compi
6	20	HEAD	35.46	discard	Advisor proposed removing the artificial 528-block cap and scaling blocks with tensor size using cdi
7	21	HEAD	33.09	discard	Advisor proposed upgrading to float4 (128-bit) loads per thread processing 8 fp16 values using 4x __
8	22	HEAD	33.08	discard	Advisor proposed two changes: (1) replace strided loop with single-pass direct mapping (one thread p
9	23	HEAD	33.56	discard	Advisor proposed per-size specialized dispatch with different thread counts per size class to tune o
10	24	HEAD	33.11	discard	Advisor proposed hybrid dispatch: float4 CUDA kernel for small tensors (N*N<=4M elements, i.e. N<=20
11	25	HEAD	32.44	discard	Advisor proposed minimizing Python dispatch overhead with pre-bound method objects and pre-allocated
